{
  "SchemaVersion": "1.0",
  "Tool": {
    "Name": "ADSecurityAudit",
    "Version": "1.0.0"
  },
  "Metadata": {
    "GeneratedAt": "2026-10-17T05:53:07Z",
    "CollectionTime": "2026-10-01T00:00:00Z",
    "DataSource": "Simulated",
    "AnalysisMode": "OfflineSnapshot",
    "Notice": "SIMULATED DATA: these results come from a synthetic fixture. They are not observations of a real domain and say nothing about the security of any real environment. Object names are pseudonymised (redacted-xxxxxxxx); redaction reduces exposure but is not anonymisation.",
    "Domain": {
      "Name": "redacted-977f5673",
      "NetBiosName": "redacted-dd12f91b",
      "DomainFunctionalLevel": "Windows2012R2Domain",
      "ForestFunctionalLevel": "redacted-714236f2"
    },
    "ConfigVersion": "1.0",
    "Modules": [
      "AccountLifecycle",
      "PrivilegedAccess",
      "Delegation",
      "Acl",
      "AuthenticationPolicy",
      "GroupPolicy",
      "Infrastructure"
    ],
    "Warnings": [],
    "Exclusions": {
      "Count": 0
    },
    "Redacted": true
  },
  "Summary": {
    "Headline": "50 active finding(s) across 41 assessed rule(s); 5 rule(s) could not be fully assessed; 0 finding(s) covered by documented exceptions.",
    "ResultsByStatus": {
      "PASS": 6,
      "FAIL": 50,
      "ERROR": 5,
      "NOT_APPLICABLE": 1,
      "NOT_ASSESSED": 1
    },
    "ActiveFindingsBySeverity": {
      "Critical": 2,
      "High": 17,
      "Medium": 20,
      "Low": 11,
      "Informational": 0
    },
    "ActiveFindings": 50,
    "ExceptedFindings": 0,
    "RulesInCatalog": 44,
    "RulesAssessed": 41,
    "RulesNotFullyAssessed": 5,
    "TopFindings": [
      {
        "Severity": "Critical",
        "RuleId": "ADSA-ACL-002",
        "Title": "Directory replication rights granted to a non-default principal",
        "AffectedObject": "redacted-7d7787d2",
        "Confidence": "High"
      },
      {
        "Severity": "Critical",
        "RuleId": "ADSA-GPO-003",
        "Title": "Group Policy Preferences cpassword found in SYSVOL",
        "AffectedObject": "redacted-906ffe8d",
        "Confidence": "High"
      },
      {
        "Severity": "High",
        "RuleId": "ADSA-ACC-005",
        "Title": "Enabled account does not require a password",
        "AffectedObject": "redacted-bbe40b96",
        "Confidence": "High"
      },
      {
        "Severity": "High",
        "RuleId": "ADSA-ACC-006",
        "Title": "Kerberos pre-authentication disabled",
        "AffectedObject": "redacted-6299ecf3",
        "Confidence": "High"
      },
      {
        "Severity": "High",
        "RuleId": "ADSA-ACL-001",
        "Title": "Non-privileged principal holds high-risk rights on a sensitive object",
        "AffectedObject": "CN=AdminSDHolder,CN=System,redacted-7d7787d2",
        "Confidence": "High"
      },
      {
        "Severity": "High",
        "RuleId": "ADSA-ACL-003",
        "Title": "Sensitive object owned by a non-privileged principal",
        "AffectedObject": "CN=Domain Admins,CN=Users,redacted-7d7787d2",
        "Confidence": "High"
      },
      {
        "Severity": "High",
        "RuleId": "ADSA-ACL-004",
        "Title": "Non-privileged principal can modify a Group Policy Object",
        "AffectedObject": "redacted-906ffe8d",
        "Confidence": "High"
      },
      {
        "Severity": "High",
        "RuleId": "ADSA-DC-001",
        "Title": "Print redacted-eb249ece service running on domain controller",
        "AffectedObject": "redacted-b462e39d",
        "Confidence": "High"
      },
      {
        "Severity": "High",
        "RuleId": "ADSA-DEL-001",
        "Title": "Unconstrained delegation",
        "AffectedObject": "redacted-30937380",
        "Confidence": "High"
      },
      {
        "Severity": "High",
        "RuleId": "ADSA-DEL-001",
        "Title": "Unconstrained delegation",
        "AffectedObject": "redacted-6de71e3f",
        "Confidence": "High"
      }
    ]
  },
  "Coverage": {
    "Rules": [
      {
        "RuleId": "ADSA-ACC-001",
        "Title": "Stale enabled user account",
        "Module": "AccountLifecycle",
        "Status": "FAIL",
        "Partial": false,
        "Results": 2,
        "Note": ""
      },
      {
        "RuleId": "ADSA-ACC-002",
        "Title": "Inactive enabled computer account",
        "Module": "AccountLifecycle",
        "Status": "FAIL",
        "Partial": false,
        "Results": 1,
        "Note": ""
      },
      {
        "RuleId": "ADSA-ACC-003",
        "Title": "Enabled account with password that never expires",
        "Module": "AccountLifecycle",
        "Status": "FAIL",
        "Partial": false,
        "Results": 3,
        "Note": ""
      },
      {
        "RuleId": "ADSA-ACC-004",
        "Title": "Potentially orphaned account (manager disabled)",
        "Module": "AccountLifecycle",
        "Status": "FAIL",
        "Partial": false,
        "Results": 1,
        "Note": ""
      },
      {
        "RuleId": "ADSA-ACC-005",
        "Title": "Enabled account does not require a password",
        "Module": "AccountLifecycle",
        "Status": "FAIL",
        "Partial": false,
        "Results": 1,
        "Note": ""
      },
      {
        "RuleId": "ADSA-ACC-006",
        "Title": "Kerberos pre-authentication disabled",
        "Module": "AccountLifecycle",
        "Status": "FAIL",
        "Partial": false,
        "Results": 1,
        "Note": ""
      },
      {
        "RuleId": "ADSA-ACC-007",
        "Title": "Weak Kerberos or password storage flags",
        "Module": "AccountLifecycle",
        "Status": "FAIL",
        "Partial": false,
        "Results": 1,
        "Note": ""
      },
      {
        "RuleId": "ADSA-ACC-008",
        "Title": "Enabled account that has never logged on",
        "Module": "AccountLifecycle",
        "Status": "FAIL",
        "Partial": false,
        "Results": 1,
        "Note": ""
      },
      {
        "RuleId": "ADSA-SVC-001",
        "Title": "Service account (SPN) with an old password",
        "Module": "AccountLifecycle",
        "Status": "FAIL",
        "Partial": false,
        "Results": 2,
        "Note": ""
      },
      {
        "RuleId": "ADSA-PRV-001",
        "Title": "Privileged group membership exceeds the configured maximum",
        "Module": "PrivilegedAccess",
        "Status": "FAIL",
        "Partial": false,
        "Results": 1,
        "Note": ""
      },
      {
        "RuleId": "ADSA-PRV-002",
        "Title": "Disabled or stale account in a privileged group",
        "Module": "PrivilegedAccess",
        "Status": "FAIL",
        "Partial": false,
        "Results": 2,
        "Note": ""
      },
      {
        "RuleId": "ADSA-PRV-003",
        "Title": "Privileged account with a password that never expires",
        "Module": "PrivilegedAccess",
        "Status": "FAIL",
        "Partial": false,
        "Results": 2,
        "Note": ""
      },
      {
        "RuleId": "ADSA-PRV-004",
        "Title": "Privileged account with a service principal name",
        "Module": "PrivilegedAccess",
        "Status": "FAIL",
        "Partial": false,
        "Results": 1,
        "Note": ""
      },
      {
        "RuleId": "ADSA-PRV-005",
        "Title": "Schema Admins group is populated",
        "Module": "PrivilegedAccess",
        "Status": "FAIL",
        "Partial": false,
        "Results": 1,
        "Note": ""
      },
      {
        "RuleId": "ADSA-PRV-006",
        "Title": "Privileged account not marked sensitive and cannot be delegated",
        "Module": "PrivilegedAccess",
        "Status": "FAIL",
        "Partial": false,
        "Results": 7,
        "Note": ""
      },
      {
        "RuleId": "ADSA-PRV-007",
        "Title": "Group membership cycle reachable from a privileged group",
        "Module": "PrivilegedAccess",
        "Status": "FAIL",
        "Partial": false,
        "Results": 1,
        "Note": ""
      },
      {
        "RuleId": "ADSA-PRV-008",
        "Title": "Account with adminCount=1 outside privileged groups",
        "Module": "PrivilegedAccess",
        "Status": "FAIL",
        "Partial": false,
        "Results": 1,
        "Note": ""
      },
      {
        "RuleId": "ADSA-DEL-001",
        "Title": "Unconstrained delegation",
        "Module": "Delegation",
        "Status": "FAIL",
        "Partial": false,
        "Results": 2,
        "Note": ""
      },
      {
        "RuleId": "ADSA-DEL-002",
        "Title": "Constrained delegation with protocol transition",
        "Module": "Delegation",
        "Status": "FAIL",
        "Partial": false,
        "Results": 1,
        "Note": ""
      },
      {
        "RuleId": "ADSA-DEL-003",
        "Title": "Constrained delegation to a domain controller service",
        "Module": "Delegation",
        "Status": "FAIL",
        "Partial": false,
        "Results": 1,
        "Note": ""
      },
      {
        "RuleId": "ADSA-DEL-004",
        "Title": "Resource-based constrained delegation configured on a domain controller",
        "Module": "Delegation",
        "Status": "FAIL",
        "Partial": false,
        "Results": 1,
        "Note": ""
      },
      {
        "RuleId": "ADSA-ACL-001",
        "Title": "Non-privileged principal holds high-risk rights on a sensitive object",
        "Module": "Acl",
        "Status": "FAIL",
        "Partial": false,
        "Results": 1,
        "Note": ""
      },
      {
        "RuleId": "ADSA-ACL-002",
        "Title": "Directory replication rights granted to a non-default principal",
        "Module": "Acl",
        "Status": "FAIL",
        "Partial": false,
        "Results": 1,
        "Note": ""
      },
      {
        "RuleId": "ADSA-ACL-003",
        "Title": "Sensitive object owned by a non-privileged principal",
        "Module": "Acl",
        "Status": "FAIL",
        "Partial": false,
        "Results": 1,
        "Note": ""
      },
      {